{
  "spec_version": "4.2",
  "naics": "541511",
  "title": "Custom Computer Programming Services",
  "methodology_snapshot": {
    "path": "V4_2_RUNTIME_METHODOLOGY.md",
    "sha256": "7ff396fd9a73b821df8fadabb2abdc235864154cc7257e304a295bcffdac4427"
  },
  "dataset_snapshot": {
    "path": "pipeline/datasets/v4_2/541511.json",
    "sha256": "3b444e7ba658157b3f809c10b4d176095ae7a53c11cd284701b3d02749a15a25"
  },
  "target_archetype": {
    "selected_id": "custom-application-development",
    "alternatives": [
      {
        "id": "custom-application-development",
        "name": "Customer-specific application development firms",
        "inclusion_criteria": [
          "More of the firm's service revenue is attributable to designing and developing bespoke software applications for particular customers than to any other enumerated archetype.",
          "The firm owns delivery of application code or a defined development workstream, whether contracted as a project, dedicated team, or time-and-materials engagement.",
          "The firm is estimated to fall in the $1 million to $10 million EBITDA target band represented by the pinned dataset."
        ],
        "exclusion_criteria": [
          "Packaged-software customization or integration is the firm's largest service-revenue category.",
          "Website or database specialty work is the firm's largest service-revenue category.",
          "Temporary staffing, IT technical consulting, or software support is the firm's largest service-revenue category.",
          "The establishment is primarily a software publisher, hosting provider, or computer-systems designer excluded from NAICS 541511 by the Census definition."
        ],
        "band_count": {
          "base": 2439,
          "low": 1900,
          "high": 3000
        },
        "source_ids": [
          "A1",
          "A2",
          "A3",
          "A4"
        ],
        "rationale": "The base is 5,767 target-band firms multiplied by a primary-equivalent share of 42.297%: the 2022 Economic Census reports that 61.3% of 541511 establishments provide custom software application design and development, and that this line supplies 69% of revenue at establishments reporting it. Multiplying prevalence by within-provider revenue share avoids counting every incidental service line as a whole firm. The 1,900-3,000 range allows for sampling variation, multiple service lines per establishment, firm-versus-establishment differences, and reweighting from the all-size Census population to the target band."
      },
      {
        "id": "packaged-software-integration",
        "name": "Packaged-software customization and integration firms",
        "inclusion_criteria": [
          "More of the firm's service revenue is attributable to customizing or integrating packaged software for customers than to any other enumerated archetype.",
          "Customer work centers on configuring, extending, connecting, migrating, or implementing third-party or packaged applications.",
          "The firm is estimated to fall in the $1 million to $10 million EBITDA target band represented by the pinned dataset."
        ],
        "exclusion_criteria": [
          "Bespoke application development is the firm's largest service-revenue category.",
          "Website or database specialty work is the firm's largest service-revenue category.",
          "Temporary staffing, IT technical consulting, or software support is the firm's largest service-revenue category.",
          "The firm primarily publishes its own software or primarily performs systems design without custom programming."
        ],
        "band_count": {
          "base": 1759,
          "low": 1250,
          "high": 2350
        },
        "source_ids": [
          "A1",
          "A2",
          "A3",
          "A4"
        ],
        "rationale": "The base is 5,767 multiplied by a 30.498% primary-equivalent share: 39.1% establishment prevalence for customization and integration of packaged software times a 78% within-provider revenue share. The range is broad because packaged integration and bespoke development commonly coexist, the product rows are not mutually exclusive, and the target-band mix may differ from the all-size industry mix. Its high endpoint overlaps the selected archetype's low endpoint, so it remains a plausible largest-count alternative."
      },
      {
        "id": "web-database-specialists",
        "name": "Website and database development specialists",
        "inclusion_criteria": [
          "Website design and development or database design and development is the firm's largest service-revenue category.",
          "The firm delivers customer-specific programming rather than primarily selling hosting, advertising, graphic design, or a published software product.",
          "The firm is estimated to fall in the $1 million to $10 million EBITDA target band represented by the pinned dataset."
        ],
        "exclusion_criteria": [
          "General bespoke application development is the firm's largest service-revenue category.",
          "Packaged-software customization or integration is the firm's largest service-revenue category.",
          "Temporary staffing, IT technical consulting, or software support is the firm's largest service-revenue category.",
          "Hosting, advertising, graphic design, or software publishing is the primary business."
        ],
        "band_count": {
          "base": 717,
          "low": 400,
          "high": 1100
        },
        "source_ids": [
          "A1",
          "A2",
          "A3",
          "A4"
        ],
        "rationale": "The base is 5,767 multiplied by 12.434%, combining primary-equivalent allocations for website services (30.8% prevalence times 31% within-provider revenue share) and database services (22.2% times 13%). The range reflects possible overlap between those product rows, the distinction between a specialty firm and an incidental line, and target-band reweighting."
      },
      {
        "id": "staff-augmentation-support",
        "name": "Programming capacity, technical consulting, and support-led firms",
        "inclusion_criteria": [
          "Temporary staffing, IT technical consulting, or software-related technical support is the firm's largest service-revenue category while the establishment remains classified in NAICS 541511.",
          "The customer primarily buys developer capacity, technical advice, or ongoing software support rather than vendor-owned delivery of a bespoke application or packaged-software implementation.",
          "The firm is estimated to fall in the $1 million to $10 million EBITDA target band represented by the pinned dataset."
        ],
        "exclusion_criteria": [
          "Bespoke application development is the firm's largest service-revenue category.",
          "Packaged-software customization or integration is the firm's largest service-revenue category.",
          "Website or database specialty work is the firm's largest service-revenue category.",
          "The establishment is primarily an employment service, management consultancy, or managed IT provider classified outside NAICS 541511."
        ],
        "band_count": {
          "base": 470,
          "low": 200,
          "high": 850
        },
        "source_ids": [
          "A1",
          "A2",
          "A3",
          "A5"
        ],
        "rationale": "The base is 5,767 multiplied by an 8.15% primary-equivalent share: temporary staffing (2.5% prevalence times 35% within-provider revenue share), IT technical consulting (11.6% times 25%), and IT technical support (17.5% times 25%). The range is wide because the rows may overlap, may be incidental at programming firms, and may include business models near other NAICS boundaries. The directory source confirms only that the engagement model exists; it does not estimate the count."
      }
    ],
    "residual": {
      "name": "Mixed, other, and unclassifiable 541511 target-band firms",
      "band_count": {
        "base": 382,
        "low": 100,
        "high": 850
      },
      "rationale": "The base is the 6.621% remainder after allocating the four primary-equivalent archetypes against the 5,767-firm band estimate. It includes firms without a dominant enumerated line, firms led by smaller Census product categories, and classification ambiguity. The endpoints allow for overlap and nonresponse in the product-line bridge."
    },
    "enumeration_coverage": {
      "base": 0.93379,
      "low": 0.82,
      "high": 0.97
    },
    "sources": [
      {
        "id": "A1",
        "url": "https://www.census.gov/naics/?details=541511&input=541511&year=2022",
        "title": "2022 NAICS definition and cross-references for 541511 Custom Computer Programming Services",
        "vintage": "2022 NAICS"
      },
      {
        "id": "A2",
        "url": "https://www.census.gov/programs-surveys/economic-census/year/2022/data.html",
        "title": "2022 Economic Census data release and access page",
        "vintage": "2022 Economic Census; accessed 2026-07-21"
      },
      {
        "id": "A3",
        "url": "https://www2.census.gov/programs-surveys/economic-census/data/2022/API_Datasets/ECNNAPCSIND2022.zip",
        "title": "2022 Economic Census Industry by Products Statistics archive",
        "vintage": "2022 data; archive released 2026-04-23"
      },
      {
        "id": "A4",
        "url": "https://clutch.co/developers",
        "title": "Clutch custom software development company directory and service taxonomy",
        "vintage": "accessed 2026-07-21"
      },
      {
        "id": "A5",
        "url": "https://clutch.co/us/it-services/staff-augmentation",
        "title": "Clutch U.S. IT staff augmentation company directory and service taxonomy",
        "vintage": "accessed 2026-07-21"
      }
    ],